{
  "id": "xedit.formid-prefix-stripping.v1",
  "title": "xEdit accepts FormIDs after edge normalization",
  "domains": ["xedit", "tooling.mutagen"],
  "appliesTo": {
    "games": ["SkyrimLE", "SkyrimSE", "SkyrimAE", "SkyrimVR", "Fallout4", "Fallout4VR", "Fallout3", "FalloutNV", "Starfield"]
  },
  "canonical": {
    "answer": "Automation callers may provide FormIDs with or without a 0x prefix when the MCP normalizes the value before sending it to xEdit.",
    "confidence": "verified-project-doc"
  },
  "sources": [
    {
      "kind": "project-internal-doc",
      "ref": "docs/internal/superpowers/plans/2026-05-26-xedit-skills-and-harness-mcp-batch1.STATUS.md",
      "sectionPath": "Now known"
    }
  ],
  "lastReviewed": "2026-06-02",
  "schemaVersion": 1
}
